//du 05/06/2019 au 07/06/2019 ‚Äî Nancy, France                 Conf√©rence INRS 2019-Les risques biologiques
var events = [
//['URL', 'TITRE', 'SOUS-TITRE', 'Dates et √©ventuellement heures', 'Lieu', 'prix', 'Date du jour ou du dernier jour en format YYYY-MM-DD'],
['https://www.meetup.com/fr-FR/OpenStreetMap-Belgium/events/264468195/', 'Missing Maps : amÈliorer OpenStreetMap pour MSF', 'atelier pratique', '24 septembre 2019 de 18-21 h', 'Bruxelles', 'gratuit', '2019-09-24],
['https://www.eiseverywhere.com/emarketing/go.php?i=681447&e=Y2hyaXN0b3BoZUBteS1wb3BweS5ldQ==&l=https://www.eiseverywhere.com/ereg/newreg.php|Q|eventid|E|465574', '14th CoU Thematic Workshops', 'Committee of Users in Security Research', '16-20 september 2019', 'Brussels', 'gratuit', '2019-09-20'],
['https://www.sre2019.eu/registration', 'Security Research Event 2019', 'Building Bridges', '6-7 novembre 2019', 'Helsinki', 'gratuit', '2019-11-07'],
['http://www.safecluster.com/essai/hackers-citoyens/', 'Freemium, low tech et expertise citoyenne', 'Safe Cluster', '1er octobre 2019', 'Aix-en-Provence', 'gratuit', '2019-10-01'],
['https://ec.europa.eu/eusurvey/runner/IndustryDay2019', 'International Forum to Advance First Responder Innovation', 'Commission Europ√©enne', '15 octobre 2019', 'Bruxelles', 'gratuit', '2019-10-15'],
['https://www.resiliency.fr/pilotage-gestion-de-crise', 'Gestion de crise : session nationale et exercice full scale de 36 h', 'HCFRN', '17/9-13/12/2019', '80 h - 70 % √† distance, 30 % √† Paris', '2500-5000 ‚Ç¨', '2019-12-13'],
['http://2019.foss4g.be/en/', 'Conf√©rence sur les logiciels cartographiques open source', 'FOSS4G', '24 octobre 2019', 'Bruxelles', 'Gratuit', '2019-10-24'],
['https://iea.u-cergy.fr/fr/manifestations-scientifiques/conferences-et-workhops/conference-europeenne-sur-les-perceptions-du-risque.html', 'Conf√©rence europ√©enne sur les perceptions du risque', 'Universit√© de Cergy-Pontoise', '13 mars 2019 - 14 mars 2019', 'Paris', '2019-03-14'],
['https://idrim2019.com/', 'The 10th conference of the international society for Integrated Disaster Risk Management', 'iDRiM 2019', '16-18 octobre 2019', 'Nice (France)', '100-450 ‚Ç¨', '2019-10-18'],
['https://www.facebook.com/gestioncrise/', '7√®me session du MOOC Gestion de crise', 'Universit√© Paris II & √âcole des Officiers de la Gendarmerie Nationale', '√† partir du 6 janvier 2020', 'internet', 'gratuit', '2020-03-01'],
['https://www.imdr.eu/offres/gestion/events_818_46997_non-2229/idees-recues-en-gestion-de-crise-etudes-de-cas-interactives.html', 'Id√©es re√ßues en gestion de crise Etudes de cas interactives', 'IMDR', '8 octobre 2019 9-17h30 ', 'IRSN, Fontenay-aux-Roses', '120 ‚Ç¨', '2019-10-08'],
['https://planu.be/pages/index.php', 'Colloque annuel', 'planu.be', '21 octobre 2019', 'TBA', 'TBA', '2019-10-21'],
['https://www.gemeente.nu/events-veiligheid/evenementenveiligheid-informatie/', 'Jaarcongres Evenementenveiligheid', 'De laatste actualiteiten en ontwikkelingen', '31 octobre 2019', 'Apeldoorn', '250-999 ‚Ç¨', '2019-10-31'],
['https://letscrowd.eu/event/international-security-expo-ise/', 'International Security Expo', 'ISE', '3 d√©cembre 2019', 'Olympia London', 'gratuit', '2019-12-03'],
['https://mailchi.mp/eena/save-the-date-communicating-with-multicultural-crowds-webinar?e=fdb164a9cc/', 'Communicating with multicultural crowds at mass gatherings', 'EENA', '12 septembre 2019', 'internet', 'gratuit', '2019-09-12'],
['https://www.eventbrite.com/e/cartographie-avec-qgis-pour-les-services-de-secours-et-de-prevention-initiation-tickets-64358800906', 'Cartographie avec QGIS pour les services de secours et de pr√©vention - initiation', 'atelier Poppy', '22 ao√ªt 2019 15h00-17h30', 'Namur', 'sur invitation', '2019-08-22'],
['http://www.safecluster.com/essai/club-resilience-et-environnement/', 'Club R√©silience et Environnement', 'Safe Cluster', '2 juillet 2019 9h - 12h30', 'Aix-en-Provence', 'Gratuit', '2019-07-02'],
['https://www.weezevent.com/colloque-mba-sp-management-de-la-securite-2019-risques-et-resilience', 'Risques et r√©silience', 'Colloque MBAsp (Gendarmerie)', '21 f√©vrier 2019', 'Paris', 'TBA', '2019-02-21'],
['https://www.eventbrite.fr/e/billets-2e-forum-securite-resilience-54529357777#', '2√®me Forum s√©curit√© et r√©silience', 'WE Demain', '19 f√©vrier 2019', 'Issy-les-Moulineaux', '85 ‚Ç¨', '2019-02-19'],
['http://www.irsd.be/website/index.php/fr/2-non-categorise/1421-conf-13june2019', 'Le changement climatique et son impact sur la s√©curit√© internationale', 'Conf√©rence de l\'Institut Royal Sup√©rieur de D√©fense', '13 juin 2019 17h-19h30', 'Bruxelles', 'gratuit', '2019-06-13'],
['https://www.civil-protection.com/', 'Climate Change - Challenges for Europe', 'European Congress on Disaster Management', '27-28 ao√ªt 2019', 'Berlin', 'gratuit (volontaires) - taux r√©duit (services publics) - 498 ‚Ç¨ (entreprises)', '2019-08-28'],
['https://www.eventbrite.com/e/cartographie-avec-qgis-pour-les-services-de-secours-et-de-prevention-initiation-tickets-62563630503', 'Cartographie avec QGIS pour les services de secours et de pr√©vention - initiation', 'atelier Poppy', '11 juillet 2019 15h30-18h30', 'Bruxelles', 'sur invitation', '2019-07-11'],
['https://zoom.us/webinar/register/WN_sIfUZ8kwSpOemQsCdmocIw', 'La pr√©paration des h√¥pitaux aux situations sanitaires exceptionnelles', 'R√©silience France', '27 juin 2019 12h-13h', 'Talk vid√©o', 'gratuit', '2019-06-27'],
['https://www.airmap.fr/wp-content/uploads/2019/03/20190919_Oriane.pdf', 'Comprendre et rena√Ætre en pr√©sence du risque ?', '17√®me colloque francophone sur le risque', '19-20 septembre 2019', 'Bayonne', '348 ‚Ç¨', '2019-09-20'],
['https://www.imdr.eu/offres/gestion/events_818_46494_non-2229/professional-values-and-codes-of-practice-for-disaster-prevention.html', 'Professional values and codes of practice for disaster prevention', 'Universit√© Paris Dauphine', '18 juin 2019', 'Paris', 'gratuit', '2019-06-18'],
['https://univ-droit.fr/actualites-de-la-recherche/manifestations/31479-la-securisation-des-infrastructures-d-approvisionnement', 'La s√©curit√© des infrastructures d\'approvisionnement', 'Universit√© de Haute-Alsace', '29 mai 2019', 'Mulhouse', '75 ‚Ç¨', '2019-05-29'],
['http://www.irma-grenoble.com/02institut/formations-irma.php?id=58', 'Implication citoyenne en cas de catastrophe' , 'R√©alit√©s et perspectives pour les collectivit√©s', '4 juin 2019 8h30-17h30', 'Aix-en-Provence', 'TBD', '2019-06-04'],
['https://www.eventbrite.fr/e/billets-4emes-rencontres-parlementaires-de-la-securite-civile-59826395359 <https://ifrasec.us10.list-manage.com/track/click?u=93fd83c7ceb08a5c3948e33ac&id=5fc01509eb&e=c91870b154> ', '4√®mes Rencontres parlementaires de la s√©curit√© civile - d√©r√®glements climatiques et implication citoyenne', 'IFRASEC', 'Mercredi 5 juin 2019', 'Paris', 'gratuit', '2019-06-05'],
['http://www.irma-grenoble.com/02institut/formations-irma.php?id=56','Ev√©nements extr√™mes et changement climatique : Quelles cons√©quences pour les territoires ?','IRMA','14 mai 2019','Grenoble','gratuit','2019-05-14'],
['https://nuitdelagestiondecrises.jeunes-ihedn.fr/index.php/programme/','La Nuit de la gestion de crises','IHEDN','29-30 mars 2019','Paris','5 ‚Ç¨','2019-03-30'],
['http://www.safecluster.com/essai/journee-numerique-et-securite-civile/', 'Journ√©e num√©rique et s√©curit√© civile', 'Safe Cluster/ENSOSP/UTT','7 mai 2019','Aix en Provence','40-150 ‚Ç¨','2019-05-07'],
['http://www.planicom.be/nos-services/modules-complementaires/',  'Formation Grands Rassemblements', 'Planicom',  '25/4/2019',	'Li√®ge',    '200 ‚Ç¨', 	'2019-04-25'],
['https://www.eiseverywhere.com/ehome/402927',  '<a href="https://app.box.com/s/hbw8c5svmfo5rap1rmgr16ml7p6dz2e0">Comit√© des utilisateurs de la recherche en s√©curit√©</a>', 'Commission europ√©enne',  '<a href="https://www.eiseverywhere.com/ehome/402927">25-29/3/2019</a>',	'Bruxelles',    'gratuit', 	'2019-03-29'],
['https://www.wessex.ac.uk/conferences/2019/disaster-management-2019',  'Disaster Management 2019', '6th International Conference',  '25-27 septembre 2019',	'Ancona, IT',    '560 - 700 ‚Ç¨', 	'2019-09-27'],
['https://cbrneconference.fr/',  '3rd International Conference CBRNE', 'Research & Innovation',  '20-23/5/2019',	'Nantes, FR',    '100 - 780 ‚Ç¨', 	'2019-05-20'],
['http://www.brandweerwestvlaanderen.be/wintercongres-2019-2',  'Brandweer West-Vlaanderen', 'Wintercongres',  '2/3/2019',	'Veurne',    '', 	'2019-03-02'],
['https://overheid.vlaanderen.be/agenda/conferentie-risicos-en-crisissen-niets-om-bang-voor-te-zijn', 'Risico\'s en crisissen: (n)iets om bang voor te zijn?', 'Vlaamse Regering', '23/4/2019 10-17h', 'Brussel', 'Gratis', '2019-04-23'],
['http://www.secours-expo.com/',  'Secours expo', '',  '4-6/4/2019',	'Paris',    'Gratuit', 	'2019-04-06'],
['https://diplomatie.belgium.be/fr/sur_lorganisation/travailler_aux_affaires_etrangeres/Formations/missions_civiles_ue/formation_gestion_crises',	'Formation g√©n√©rique gestion civile des crises - Appel √† Candidatures', 	'SPF Affaires √©trang√®res',	  '25/3-5/4/2019', 	'Bruxelles', 'sur dossier',  	'2019-04-05'],
['https://www.hcfdc.org/checkout/registration/colloque/80',	'R√©silience 360¬∞ : quelle strat√©gie de r√©silience pour 2025-2030 ?', 	'Haut Comit√© Fran√ßais pour la D√©fense Civile',	  '2/4/2019', 	'Paris', '100 ‚Ç¨',  	'2019-04-02'],
['http://www.entente-valabre.com/technosdays/',			'Vers les technologies 3.0, de la formation √† la gestion de crise', 	'Technos Days Valabre',				  '8-10 octobre 2019', 	'Valabre', 'gratuit',  	'2019-10-10'],
['https://eenaconference.org/',					'Conf√©rence EENA (agence pour le num√©ro 112)', 						'',				  '10-12/4/2019', 	'Dubrovnik', '',  	'2019-04-12'],
['https://www.politeia.be/mailing/html/polpub20190130je-plansdurgence.html', 'S√©minaire plans d\'urgence et d\'intervention' , 'UCLouvain / GEPS / Politeia', '19/3/2019 13-17 h', 'Louvain-la-Neuve', '135 ‚Ç¨', '2019-03-19'],
['https://app.box.com/s/agulg2ailz2ljw00wmwwn9fnktzlvr31', 'Nouvelles formations CBRN pour urgentistes. Le temps court et la menace est r√©elle... √ätes-vous vraiment pr√™ts ?', 'S√©minaires du Certificat Universitaire en Gestion des situations d\'exception', '5/3/2019 18-21h', 'Brussels', 'free', '2019-03-05'],
['https://fosdem.org/2019/schedule/event/geo_osmqgis/', 'OpenStreetMaps for emergency prep: The view from San Francisco', 'FOSDEM 2019', '3/2/2019 14:45-15:15', 'Brussels', 'free', '2019-02-03'],
['https://formation-continue.ehesp.fr/formation/cycle-gestion-de-crise/', 'Gestion des situations sanitaires exceptionnelles', '√âcole des Hautes √©tudes de sant√© publique', '16 j du 18/3-22/11/2019', 'Internet', '1650 ‚Ç¨', '2019-11-22'],
['https://zoom.us/webinar/register/WN_8TIEWGyoRy-O_1mwq0-eMQ', 'Regards crois√©s sur l\'alerte', 'Talk vid√©o HCFDC', '20/12/2018', 'Internet', 'gratuit', '2018-12-20'],
['https://www.fun-mooc.fr/courses/course-v1:Paris2+09004+session06/about', 'Gestion de crise', 'Cours en ligne', '14/1/2019', 'Internet', 'gratuit', '2019-02-04'],
['https://cap-alert2019.sciencesconf.org/', 'Cap\'Alert', 'Colloque sur l\'alerte des populations', '19-21/3/2019', 'Avignon', '40-100 ‚Ç¨', '2019-03-21'],
['https://www.facebook.com/events/293680187897381', 'Mass Gathering Solutions', 'Wetenschappelijke avond rond eindejaarsevenementen', '13/11/2018', 'Jette, Brussels', 'gratis', '2018-11-13'],
['https://www.pmrexpo.de/en/pmrexpo/', 'PMRExpo 2018', 'Professional Mobile Radio & Control rooms', '27-29/11/2018', 'Cologne', '35-500 ‚Ç¨', '2018-11-29'],
['https://www.weezevent.com/de-la-securite-globale-a-la-gestion-des-crises-sanitaires', 'Crise sanitaire, une √©preuve humanitaire', 'Rendez-vous de la r√©flexion strat√©gique', '14/11/2018', 'Paris', 'gratuit', '2018-11-14'],
['https://www.eiseverywhere.com/ehome/364210?&t=5bc53872bc8a5df627beda27f9585f89&eb=590034', 'Committe of Users in Security Research',  'European Commission' ,'3-4/12/2018', 'Bruxelles', 'gratuit', '2018-12-04'],
['https://www.sre2018.eu/ free', 'Security Research Event',  'European Commission','5-6/12/2018', 'Bruxelles', 'gratuit', '2018-12-06'],
['http://www.horizon2020.gouv.fr/cid131435/registration-european-brokerage-event-drs-2019-24th-october-2018.html', 'European Brokerage Event on Resilience from disaster 2019',  '','24/10/2018', 'Paris', 'gratuit', '2018-10-24'],
['https://www.psc-europe.eu/news-events/events/psce-conference-in-bled-2018.html', 'Public Safety Communications Europe Conference',  '','12-13/12/2018', 'Bled, Slovenia', '', '2018-12-13'],
['https://www.eventbrite.com/e/billets-2eme-colloque-centralesupelec-ifrasec-resilience-face-aux-crises-et-fiabilite-des-organisations-50232331255?aff=&mc_cid=a7e5819227&mc_eid=c91870b154', 'R√©silience face aux crises et fiabilit√© des organisations', 'Colloque IFRASEC-Supelec', '14/11/2018', 'Gif sur Yvette', 'gratuit', '2018-11-14'],
['http://www.amaris-villes.org/inscrivez-vous/', 'Visite de terrain - Vall√©e de la Chimie', '', '4-5/10/2018', 'Lyon', 'gratuit', '2018-10-05'],
['https://www.rodekruis.be/provincie/west-vlaanderen/symposium-medisch-rampenmanagement/', '14de Symposium Medisch Rampenmanagement', 'Rode Kruis Vlaanderen', '27/10/2018', 'Blankenberge', '150 ‚Ç¨', '2018-10-27'],
['http://seolane.net/lm21/intro.php', 'Ma√Ætrise des risques et transformation num√©rique‚ÄØ: opportunit√©s et menaces', 'Congr√®s Lambda Mu 21', '16-18/10/2018', 'Reims', '1635 ‚Ç¨ (√©tudiants:50 ‚Ç¨)', '2018-10-18'],
['https://www.eventbrite.com/e/cartographie-avec-qgis-pour-les-services-de-secours-introduction-tickets-49687106473', 'QGIS pour les services de secours', 'Atelier Poppy', '18/10/2018', 'Bruxelles', 'gratuit', '2018-10-18'],
['https://academieairespace.com/grandsprojets', 'La gestion des grands projets - Retour d\'exp√©rience', '', '10-11/12/2018', 'Paris', '500 ‚Ç¨ (√©tudiants : 50 ‚Ç¨)', '2018-12-12'],
['http://www.jac.cerdacc.uha.fr/', 'La m√©moire industrielle, facteur de pr√©vention du risque. Le cas du d√©mant√®lement', '', '23/11/2018', 'Colmar', 'gratuit', '2018-11-23'],
['https://milipol.com','Milipol', 'Salon de la s√©curit√© int√©rieure des √âtats', '19-22 novembre 2019', 'Paris', 'gratuit', '2019-11-22'],
['https://www.security-systems-valley.fr/festival', 'Festival du film de s√©curit√©', '', '02/10/2018', 'Enghien-les-Bains (France)', '', '2018-10-02'],
['http://www.symposium-urgence-charleroi.be', 	 '18√®me Symposium de m√©decine d\'urgence de Charleroi',              'Urgences extr√™mes',    '23/11/2018', 'Charleroi', '',     '2018-11-23'],
['http://www.politiestudies.be/vrij.cfm?Id=416', 'Innovatie in de opsporing: kansen en bedreigingen van Blockchain', 'CPS-studievoormiddag', '20/9/2018',  'Brussel',   '95 ‚Ç¨', '2018-09-20'],
['https://www.facebook.com/MedicalComponentBe/photos/a.265836350249424.1073741829.264732473693145/1048475105318874/?type=3&theater', 'Congr√®s de la Composante M√©dicale et de l\'HMRA', 'disaster & CBRN', '3-4/10/2018', 'Bruxelles', '', '2018-10-04'],
['http://www.chu-nimes.fr/actu-cht/congres-de-medecine-de-catastrophe.html',							'Congr√®s de m√©decine de Catastrophe',   '(source : <a href="https://www.linkedin.com/in/thomastonneau/">T. Tonneau</a>, formateur)', 				 '27/09/2018', 'N√Æmes', 'gratuit', '2018-09-27'],
['https://www.hcfdc.org/fr/guest/Actualites#',											'RETEX sur l\'ouragan Irma ', 		'',                              '13/09/2018', 'Paris', '100 ‚Ç¨', '2018-09-13'],
['https://planu.be',														'Colloque Planu.be', 			'',                              '22/10/2018', 'Namur', '75 ‚Ç¨', '2018-10-22'],
['https://www.eventbrite.fr/e/billets-penser-la-catastrophe-nucleaire-46707931681',						'Penser la catastrophe nucl√©aire', 		'',                              '22/06/2018 9h-12h30', 'Paris', 'gratuit', '2018-06-22'],
['https://www.webs-event.com/DOCUMENTS/c-i.pdf',										'Sites √† risques', 'Comment faire face √† l\'√©volution des enjeux de s√©curit√© ?', '26/06/2018 8h45-17h30', 'Paris', '396 ‚Ç¨', '2018-06-22'],
['https://cybercercle.com/rendez-vous/4emes-journees-cybersecurite-et-territoires-a-toulouse/',					'4√®mes journ√©es Cybers√©curit√© et Territoires', '','20/09/2018', 'Toulouse','','2018-09-20'],
['https://drive.google.com/file/d/1SUY_Ue8yntpe1Bmq8iVhmkoA4Qri7Tl4/view',							'D√©cision en situation de crise et d‚Äôincertitude :', 'Des mod√®les fragiles aux mod√®les agiles.','16-17/11/2018', 'Oujda (Maroc)','','2018-11-17'],
['http://www.paca.developpement-durable.gouv.fr/de-la-prevision-des-crues-a-la-gestion-de-crise-a10591.html',			'De la pr√©vision des crues √† la gestion de crise', 'Colloque de la Soci√©t√© Hydrotechnique de France','14-16/11/2018', 'Avignon','335 ‚Ç¨','2018-11-16'],
['http://formcont.ulb.ac.be/session/viewSelected/2202',										'Le Plan d\'Urgence Hospitalier', 'S√©minaire de gestion des situations d\'exception','18/1/2018, 18h-21h', 'Bruxelles','Gratuit','2018-01-18'],
['http://mailchi.mp/1a94e08d676b/rappel-participez-au-colloque-ifrasec-centrale-paris-rsilience-face-aux-crises?e=c91870b154',  'Colloque ¬´ R√©silience face aux crises ¬ª', 	'IFRASEC', 			  '7/2/2018', 		'Paris',    'Gratuit', 	'2018-02-07'],
['http://www.besedim.be/',  													'Colloque annuel', 				'BESEDIM', 			  '20/1/2018', 		'Bruxelles',    '', 	'2018-01-20'],
['https://www.ici-belgium.be/gestion-de-crise-le-necessaire-renforcement-des-formations-des-services-de-securite-du-role-des-acteurs-de-terrain-en-particulier/', 'Gestion de crise : la nouvelle menace', 'The European Society for Defence', '23/1/2018', 'Les Bons Villers', '30 ‚Ç¨', '2018-01-23'],

['http://www.amrae-rencontres.fr/fr/programme/1',										'26√®mes rencontres du risk management', 	'', 		  '7-9/2/2018', 'Marseille', '1305 ‚Ç¨ (√©tudiants : 146 ‚Ç¨)', 	'2018-02-09'],
['http://www.secours-expo.com/', 												'Secours expo',					'',				  '8-10/2/2018',	'Paris',    'Gratuit', 	'2018-02-10'],
['https://www.iemergencyweb.be/live/index.php?part=2&a=4&b=979&c=1&d=33&f=0&lang=fr&aText=exrradqxsrnlfirodsjw&bText=&cText=',	'Congr√®s des Sapeurs-Pompiers zone NAGE',	'',				  '22/2/2018',		'Namur',    'Gratuit', 	'2018-02-22'],
['https://docs.my-poppy.eu/colloques/R√©sum√©_Colloque_DEMOCRITE.pdf',								'Colloque risques & menaces', 			'(projet D√©mocrite)', 		  '27/2/2018',    	'Paris',    'Gratuit', 	'2018-02-27'],
['https://afiu.be/reunion-scientifique-2018/',											'Association Francophone des Infirmiers(√®res) d\'Urgence', 'r√©union scientifique','13/3/2018', 		'Namur',    'Gratuit', 	'2018-03-13'],
['http://formcont.ulb.ac.be/session/viewSelected/2202',										'S√©minaire de gestion des situations d\'exception', '',				  '15/3/2018, 18h-21h','Bruxelles', 'Gratuit', 	'2018-03-15'],
['http://www.eena.org/press-releases/eena-2018-programme',									'Conf√©rence EENA (agence pour le num√©ro 112)', 	'',				  '25-27/4/2018', 	'Ljubjana', '',  	'2018-04-25'],
['http://www.irma-grenoble.com/PDF/02institut/2018/formation_flyers_2018.pdf',							'Intercommunalit√© et gestion de crise', 	'IRMA - Journ√©e technique', 	  '17/5/2018', 		'Grenoble', '', 	'2018-05-17'],
['https://www.psc-europe.eu/',													'Public Safety communications Europe', 		'', 	 			  '24-25/5/2018', 	'Bruxelles', '', 	'2018-05-25'],
['https://www.preventica.com/congres-salons-preventica.php',									'Preventica 2018' , 				'',				  '29-31/5/2018',		'Lyon', 	    'Gratuit', 	'2018-05-31'],
['https://www.preventica.com/congres-salons-preventica.php',									'Preventica 2018' , 				'',				  '2-4/10/2018',		'Bordeaux', 	    'Gratuit', 	'2018-10-04'],
['https://www.expoprotection.com/',												'Expoprotection',				'',				  '6-9/11/2018',	'Paris',    'Gratuit', 	'2018-11-09'],
['http://www.irma-grenoble.com/PDF/02institut/2018/formation_flyers_2018.pdf',							'Plan sp√©cifique innondations',			'IRMA - Journ√©e technique',	  '4/12/2018',		'Grenoble', '', 	'2018-12-04'],
['http://www.easyfairs.com/fileadmin/groups/6/SECURA_BE_2017/Downloads/WorkSafe_2019.pdf',					'Worksafe 2019',				'',				  '27-28/3/2019',	'Antwerpen','Gratuit', 	'2019-03-28'],
['http://www.infopol-xpo112.be/fr/home/#.WbkqObJJaHs',										'Infopol | Xpo112 2019',					'',				  '2-4/4/2019',	'Kortrijk', 'Gratuit', 	'2019-04-04'],
['https://www.osgeo.asso.fr/foss4gfr-2018/',											'FOSS4G France - g√©omatique libre, avec un probable track "Gestion de crise"', '', 	  '15-17/5/2018', 	'Paris', '', '2018-05-17'],
['https://web.jrc.ec.europa.eu/rem/#m101151', 											'Disaster Risk Management Knowledge Centre', '3rd Annual Scientific Seminar', 	  '26-27/4/2018', 'Sofia', '', '2018-04-27'],
['http://www.essenscia.be/fr/Calendar/Registration/476', 									'1er Forum Seveso', 				'Essencia', 			  '20/3/2018', 'La Hulpe', 'Gratuit', '2018-03-20'],
['http://ec.europa.eu/echo/partnerships/civil-protection-partners/forum-de-protection-civile_fr', 				'European Civil Protection Forum', 		'DG ECHO', 			  '5-6/3/2018', 'Bruxelles', '', '2018-03-06'],
['http://www.entente-valabre.com/technosdays/programme.html', 									'Technos Days de Valabre', 			'Inondations', 		 	 '24/5/2018',   'Valabre', '', '2018-05-24'],
['https://www.antwerpmanagementschool.be/evenement/overheid-of-overhead-2-0/',							'Overheid of Overhead 2.0', 'Kunnen we een crisis √©cht managen?','5/5/2018, 8h30-13h30', 'Antwerpen','50 ‚Ç¨','2018-05-05'],
['https://www.visov.org/',													'We are VOST', 'Special Gathering for Virtual Operations Support Teams','13-15/9/2018', 'Germany','','2018-09-15'],
['https://www.astrid.be/fr/userdays/',												'Astrid User Days', '','3-4/10/2018', 'Bruxelles','','2018-10-04'],
['https://www.eventbrite.fr/e/inscription-3emes-rencontres-parlementaires-de-la-securite-civile-44372811273',			'IFRASEC', '3√®mes rencontres parlementaires de s√©curit√© civile','25/4/2018 9-17 h', 'Paris','gratuit','2018-04-25'],
['http://en.kpk.gov.pl/horizon-2020-secure-societies-international-info-day-and-brokerage-event-in-warsaw/',			'Horizon 2020', 'Brokerage event - Secure societies','11/4/2018', 'Varsovie','gratuit','2018-04-11'],
['https://http://begeo.be/programme/',												'Be Geo 2018', 'Track : prot√©ger et sauver des vies','24/4/2018', 'Bruxelles','gratuit','2018-04-24'],
['https://www.ecologique-solidaire.gouv.fr/rencontres-recherche',								'La crise dans la crise', 'Comment g√©rer l\'extraordinaire : anticipation ou improvisation ?','13/4/2018 11-12h30', 'Paris + web','gratuit','2018-04-13'],
['http://www.cartong.org/fr/node/3681',												'GeOnG', "'Perfection' versus 'Good enough' in Information Management - Adjusting to context, scale, phase & funding",'29-31/10/2018 11-12h30', 'Chamb√©ry','','2018-10-31'],
['http://www.rescue-week.com',													'Rescue Week', "Secours Expo + Secours & Vous",'4-7/2/2019', 'Paris','','2019-02-07'],
['https://meetings.webex.com/collabs/#/meetings/detail?uuid=M8JW27H2XQD4VYENU4KNK69RXN-QVXR&rnd=725055.74723',			'Resistant Webinar', "Enhance crisis management through standardisation",'19/4/2018', 'Web','','2018-04-19'],
['https://meetings.webex.com/collabs/#/meetings/detail?uuid=M4T823K0LCLFMBIXO3I719Y0QP-QVXR&rnd=498273.46838',			'Resistant Webinar', "Enhance crisis management through standardisation",'24/4/2018', 'Web','','2018-04-24'],
];
